{
  "$schema": "../schemas/character.schema.json",
  "id": "friend-jack",
  "name": "Jack",
  "sprite": {
    "asset": "placeholder",
    "path": "",
    "shirtColor": "#ef4444",
    "faceColor": "#fde68a"
  },
  "portrait": {
    "asset": "generated",
    "path": "",
    "backgroundColor": "#1f2937",
    "shirtColor": "#ef4444",
    "faceColor": "#fde68a",
    "hairColor": "#111827"
  },
  "movementSpeed": 42,
  "dialogueColor": "#facc15",
  "emotes": {}
}
