{
  "$schema": "../schemas/character.schema.json",
  "id": "beth",
  "name": "Beth",
  "sprite": {
    "asset": "placeholder",
    "path": "",
    "shirtColor": "#a855f7",
    "faceColor": "#fde68a"
  },
  "portrait": {
    "asset": "generated",
    "path": "",
    "backgroundColor": "#172554",
    "shirtColor": "#a855f7",
    "faceColor": "#fde68a",
    "hairColor": "#3b0764"
  },
  "movementSpeed": 44,
  "dialogueColor": "#bae6fd",
  "emotes": {}
}
